,author,created_utc,selftext,subreddit,title,url,created
250,nopointinlife1234,1613585015,"I got an email that told me that Summer quarter was full. I felt rejected, since applications were only officially ending 2 days ago.

But, upon speaking on the phone, turns out I wasn't rejected! Because, I was an ideal candidate, they immediately accepted me for Fall! 

In the course of one phone call, I went from thinking I was rejected, to celebrating my acceptance!

Heck of a morning. Load of my shoulders, to be sure.",happy,I just got accepted to an MLIS program for fall!,https://www.reddit.com/r/happy/comments/lm0k73/i_just_got_accepted_to_an_mlis_program_for_fall/,1613556215.0
251,GandalfTheBlak,1613583648,,happy,😁,https://i.redd.it/eqkrajh3r2i61.png,1613554848.0
252,theFilipina_bean,1613547742,,happy,was having an anxiety attack and has gotten alot better after seeing how this painting turned out so I wanted to share :),https://i.redd.it/0q6rdj7cszh61.jpg,1613518942.0
253,BonniePonnie,1613543999,"This is wholesome, a huge coincidence, and awesome.. it just made me so happy! So today I pulled my little team together, and our bigger team for a very socially distanced short celebration to recognize all the hard work they have put in on a big project and contributed too.  I’m not a manager or anything but I do run this project we are working on, and I just feel it’s really important to highlight milestones.  I gave a short speech on everyone’s contributions thanking them for getting us where we are, and then everyone got snacks.  

I went about my day and then an email pops in from HR, my boss put in an award for me for the same project that finally hit.. but what are the odds it would come on the very same day I decided to celebrate my teams achievements? I was so happy just to be able to celebrate their accomplishments, but to discover someone was also celebrating mine was a total surprise and really brought me so much joy that today everyone was recognized for a job well done.",happy,"I got an award today, on the same day I celebrated my team for their achievements",https://www.reddit.com/r/happy/comments/llo40i/i_got_an_award_today_on_the_same_day_i_celebrated/,1613515199.0
254,Sohan_714,1613541115,,happy,Happy Jacob 😁,https://i.redd.it/xngegqwm8zh61.jpg,1613512315.0
255,blurryligeia,1613514744,,happy,Got my vaccine! Things are looking up!,https://i.redd.it/puccdkp32xh61.jpg,1613485944.0
256,Aeternus057,1613513338,"I know this seems stupid but as far as I can remember I haven’t seen a pigeon in person, until today. It was amazing. They are beautiful. By far the best part of my day.",happy,I saw a pigeon for the first time today!,https://www.reddit.com/r/happy/comments/llezkc/i_saw_a_pigeon_for_the_first_time_today/,1613484538.0
257,photocopytimmy,1613511859,"&amp;#x200B;

[Link to video - https:\/\/youtu.be\/6Oqcusu6\_hU](https://preview.redd.it/wpimmrgetwh61.jpg?width=1025&amp;format=pjpg&amp;auto=webp&amp;s=b38799202b55ce8bc6eea7303ce87f1b5fefbcae)",happy,I filmed my 2-year-old daughters entire day in Slow-Mo and now I can't stop smiling ear to ear.,https://www.reddit.com/r/happy/comments/lleh0l/i_filmed_my_2yearold_daughters_entire_day_in/,1613483059.0
258,Brianna1919,1613482734,,happy,Hope y’all have an amazing day today 😊❤️,https://i.redd.it/qikzqfd1fuh61.jpg,1613453934.0
259,brianna9191,1613481593,,happy,Feeling cute today. Have a wonderful day fellow redditors 💖☺,https://i.redd.it/g2hurv4mbuh61.png,1613452793.0
260,gloves1992,1613477056,,happy,Two weeks in. Tired but content and in love.,https://i.redd.it/sfkwxagzxth61.jpg,1613448256.0
261,gloves1992,1613476930,,happy,Tired but content,https://i.redd.it/g7nfa8woxth61.jpg,1613448130.0
262,G1LG4M3SHHH,1613466657,,happy,"My dog is my best friend. We’ve driven all over the west and found tons of hidden parks, beaches and friends. We hang out all day every day and it never stops making me happy.",https://www.reddit.com/gallery/ll0491,1613437857.0
263,ezililefm,1613464288,,happy,"After 2 years of saving, 6 months of working 2 jobs with 15+ hour days, I finally got the money to apply to a language school halfway across the world. Today, I was accepted and informed that the apartment I wanted would be rented out to me! Hard work truly pays off.",https://i.redd.it/ex7zgh747j001.jpg,1613435488.0
264,faizifm143,1613456601,,happy,German Shepherd Dog Playing With Water | True Face of Happiness,https://youtu.be/OXntgBhZi0Y,1613427801.0
265,Soyboyokrachimp,1613455484,,happy,My first good day after 24 bad day streak. Feeling hopeful with new medicine,https://i.imgur.com/UKcWIER.jpg,1613426684.0
266,Soyboyokrachimp,1613455273,,happy,New Medicine helping me. 1st good day in a 24 bad day stretch :),https://i.imgur.com/ctLEIpX.jpg,1613426473.0
267,dimpld9,1613453715,,happy,"I've always wanted a cat and last year, I rescued Leia and now I get why people say their pets are the love of their lives. Everyday, I come back from work and she melts away my stress by just looking damn adorable. She's 9 months old already, but she's always a baby to me :')",https://i.redd.it/j5ni9p4p0sh61.jpg,1613424915.0
268,RickyAA,1613450887,,happy,5 day lockdown in Melbourne. Local radio host dances it off for the next 5 days,https://v.redd.it/rewl95c5srh61,1613422087.0
269,throwaway098798,1613445129,[removed],happy,What makes you happy?,https://www.reddit.com/r/happy/comments/lkudr0/what_makes_you_happy/,1613416329.0
270,thatonekidintheroomx,1613445065,,happy,Dog is scared of stranger at first. Until he realizes that it's the human that he was stolen from 2 years ago,https://v.redd.it/mayqez5k2qh61,1613416265.0
271,[deleted],1613441050,[deleted],happy,"He got me slippers and I made him dinner. When life is good, it's really good.",https://imgur.com/V8oHyGU,1613412250.0
272,photocopytimmy,1613440434,,happy,"I was worried about how fast she was growing up, until I found a way to slow things down, and now I'm a happy father.",https://youtu.be/6Oqcusu6_hU,1613411634.0
273,varuneco,1613438859,,happy,Finally crossed 100 Karma! I love you guys so much &lt;3,https://i.redd.it/7cnnwr7ksqh61.jpg,1613410059.0
274,Fifteen_inches,1613437315,,happy,I got married on 12/21 to the best person in the world. I cannot state how blessed my life is every day with her in it.,https://i.redd.it/r5yib7kznqh61.jpg,1613408515.0
275,Fifteen_inches,1613437229,,happy,Got married on 12/21 to the best personin the world. I cannot state how much of a blessing every day is with her.,https://i.redd.it/6js1d9dqnqh61.jpg,1613408429.0
276,anthonytrainer,1613436191,,happy,"One of my favourite hikes in northern Ontario, Canada! Travel with friends and meet other hikers along the way. Such nice people that all just want a good vibe. It’s interestingly surprising how nice so many people are nowadays:)",https://i.redd.it/nn3z896nkqh61.jpg,1613407391.0
277,Karry723,1613436091,[removed],happy,MisunderstoodnoMore a social media campaign for depression,https://www.reddit.com/r/happy/comments/lkrlbx/misunderstoodnomore_a_social_media_campaign_for/,1613407291.0
278,Karry723,1613435916,[removed],happy,Depression resources,https://www.reddit.com/r/happy/comments/lkrjbp/depression_resources/,1613407116.0
279,harold_the_cat,1613429650,,happy,Every year I get matching tattoos on Valentines Day. Yesterday was year 4! It's my favorite tradition that makes me happy,https://www.reddit.com/gallery/lkpgfg,1613400850.0
280,lily-------,1613428472,,happy,this is my first time posting here but i wanted to share my fav redditor saw my post and it really made me happy!!,https://i.redd.it/u2vomruoxph61.jpg,1613399672.0
281,glitterfilledletter,1613423866,,happy,"My fiance knows I don't like diamonds, so he contacted the Ford museum and they helped him locate a piece of Fordite that came from the same plant and was made in the same year that contained the color my 1965 project Mustang was originally. He had it made into the ring that he proposed with.",https://www.reddit.com/gallery/lknfa1,1613395066.0
282,Domidoms,1613420558,,happy,"Happy to announce that I am engaged to my sweetheart and it's definitely a happy day in my life to remember, so I thought I'd share with you lovely people.",https://i.redd.it/57rejqk5aph61.jpg,1613391758.0
283,ogemaballs,1613420406,,happy,"I’m 90 days sober today! They say the first 90 days is the hardest 💪 it was not easy, but I FEEL ALIVE 😍 so grateful for all the people that have supported me through this one day at a time journey!",https://www.reddit.com/gallery/lkm5r6,1613391606.0
284,Thorbort6969,1613419889,,happy,Daily Thoughts 82. Today was the first day of Line Cook. I have found my career. 23 years old and I know what I want to be.,https://i.redd.it/cwm0pw268ph61.jpg,1613391089.0
285,WHAXMusic,1613418995,"Hi!

I'm an indie musician in Denver who makes music in my garage. 

I wrote a new song about the mood-lifting power of a good walk (this year has given good reason for needing this a lot.)

Then I wandered around RINO (neighborhood in Denver) with my videographer brother looking to film ""Denver's Happiest Walker.""

It was good vibes for all and thought it would be a fun video for the community to be happy and walk to!

Here's the video in case you want to check it out!

[https://www.youtube.com/watch?v=MxO56sxNI1s](https://www.youtube.com/watch?v=MxO56sxNI1s)

Best,

WHAX",happy,Finding Denver's Happiest Walkers Through Music,https://www.reddit.com/r/happy/comments/lklms5/finding_denvers_happiest_walkers_through_music/,1613390195.0
286,BraverBrilliance,1613415287,,happy,"I took my Credit Score from 504 to 700, I'm so happy!",https://www.reddit.com/r/happy/comments/lkk9ms/i_took_my_credit_score_from_504_to_700_im_so_happy/,1613386487.0
287,Vardalia,1613409858,,happy,I am so happy that my family now makes kids shows together! My wife and four kids all contribute and for once in our lives we have the same hobby! Please share with your family and show us some love if you enjoy! 😊,https://youtu.be/WDJyd0UhZeE,1613381058.0
288,dgic,1613407182,,happy,"After feeling really low for weeks, I finally got out for a long cliff walk today. It felt great to have the wind in my hair!",https://i.redd.it/xagizbwb6oh61.jpg,1613378382.0
289,LawAndOrderPizza,1613406387,"When I was 8 years old my brother died unexpectedly from a disease we had no idea he had. We used to listen to the music of a very popular artist together and be huge fans. This artists music has made my life much more bearable as their music has helped me not go down a dark abyss, because it's a reminder of my brother --it's a very strong connection. 

A friend of mine has the capability of making it so I can meet this artist and have a conversation with them, to be able to thank them for making life happier and easier for me. The fact that I am going to be meeting this person once covid is over, cures years worth of pain, even when I haven't even met them yet. 

Thank you so much to my amazing friend who made this possible. My heart is filled with joy and happiness and I will never be able to thank you enough.",happy,"I am probably going to be meeting my idol. This takes years of pain away, I am so happy.",https://www.reddit.com/r/happy/comments/lkh22m/i_am_probably_going_to_be_meeting_my_idol_this/,1613377587.0
290,PutFormer,1613405226,[removed],happy,I woke up a different person today.,https://www.reddit.com/r/happy/comments/lkgnof/i_woke_up_a_different_person_today/,1613376426.0
291,smooth_grooves,1613404360,,happy,"Smooth and upbeat instrumentals featuring many production styles and artistic expressions, the soundtrack for a relaxing and productive day. Shuffle and enjoy~~",https://open.spotify.com/user/1215224467/playlist/28hLyn3dYE70ZOKye24IhI,1613375560.0
292,Nein_fegelein,1613401722,,happy,My Teacher understand that I have fear of camera Finally someone understand me and not being beaten up and threaten to get disowned,https://www.reddit.com/r/happy/comments/lkfhiv/my_teacher_understand_that_i_have_fear_of_camera/,1613372922.0
293,adesperatebitch,1613397036,"My boyfriend of (recently 3 months) has made me happier than I could be in my entire life. He makes me cry tears of joy, makes me laugh, always plays with me, and is always supportive of everything I do. He's intelligent, kind, funny, handsome, caring, and the perfect man for me. I can't believe he chose me out of 3.4 billion people. I've never wanted to cherish someone, love for someone so much. To be frank, before meeting him I've told myself I wouldn't date until I was 30. I wasn't looking for love. I never really understood love. But his perfection opened my eyes. He's my sunshine, my ray of happiness, always bringing me joy even during tough times. I hope I can be the same for him. Seeing him smile is the greatest gift of all.

I love you, my handsome prince. 😊

Hey, fun fact: we met on reddit! I posted a pic of myself (on my other account), he followed me, I said hi, and the rest is history :). We started dating after a month!",happy,I found true love. And have never been happier.,https://www.reddit.com/r/happy/comments/lke1fi/i_found_true_love_and_have_never_been_happier/,1613368236.0
294,Yazutann,1613393330,"I’ve made several posts about how much my job just sucks so much. I put in my two weeks!  I got a new job already at an awesome place and I’m so excited!  If it tells you how much this place sucks right now, I called in because the weather where I live is awful. We’re supposed to get over a foot of snow in the next couple hours and yet my boss wanted me to go to work.  My job is DRIVING PLACES! I said NO! Feels so good to lay at home where I’m safe Instead of risking crashing because my boss is a bitch. 

Wahoo!",happy,Finally quitting my toxic job! Said NO instead of risking my health to drive on bad roads all day!,https://www.reddit.com/r/happy/comments/lkd0yc/finally_quitting_my_toxic_job_said_no_instead_of/,1613364530.0
295,Yazutann,1613393224,[removed],happy,Finally quitting my toxic job!,https://www.reddit.com/r/happy/comments/lkd004/finally_quitting_my_toxic_job/,1613364424.0
296,pixiedust1022,1613391738,,happy,My husband surprised me with this pizza for Valentine's Day. He secretly requested that the sausages be in the shape of a heart!,https://i.redd.it/5h5n0qauumh61.jpg,1613362938.0
297,MiddleofInfinity,1613378533,,happy,Every time I hear this one I can’t stop my leg from bouncing &amp; I have to start singing along. Always makes me happy,https://m.youtube.com/watch?v=C9bw4zQkxWk,1613349733.0
298,MiddleofInfinity,1613378382,,happy,Happy everytime,https://m.youtube.com/watch?v=C9bw4zQkxWk,1613349582.0
299,ManFromForests,1613377457,,happy,Let This Pokémon Lo-fi Make Your Day! (By Mipsick),https://v.redd.it/gi5lrw5zplh61,1613348657.0
300,eliizabeth1901,1613376503,,happy,"I am very happy, it was a good Valentine's day",https://i.redd.it/ca54sam5nlh61.jpg,1613347703.0
301,Zartheona,1613375694,,happy,I wanted to share this somewhere. I think here is the right place. I have many chronic illnesses that are ravaging my body. Surfing has been on my bucket list since I was a child.,https://i.redd.it/adimp73rklh61.jpg,1613346894.0
302,elvgxnce,1613373544,,happy,i made this dreamy you’re the main character type of playlist!! i hope you all enjoy it 💜,https://open.spotify.com/playlist/5YmZCeSN7uc3tjLThcONOk?si=XVREFj79RqC5iDhMc0OhZg,1613344744.0
303,sunbum501,1613373168,"happy vday everyone I hope you got to feel and share love today even if it wasn’t romantic. 
I just wanted to hop on here and say that I am so happy with the person I’m with. I’ve had terrible luck in the past. I’ve been treated horribly and put through things I didn’t deserve. I’ve felt heartbreak that I honestly believed I would never recover from and I didn’t think I’d ever move on let alone find what I’ve always wanted. but today my heart is full because my boyfriend made it official today!!! what a special day for me. he is the sweetest, smartest, dorkiest guy that I never saw coming. I’m so glad that old things didn’t workout the way I used to want them to so badly. I’m so glad I learned to see my worth and stop seeing people who don’t. I am so glad I didn’t give up on myself or the idea of someone else loving me too. I am so happy. healthy love is out there and I couldn’t be more excited that I get to keep experiencing it with him",happy,I found the healthy love I’ve always wanted and deserved,https://www.reddit.com/r/happy/comments/lk893h/i_found_the_healthy_love_ive_always_wanted_and/,1613344368.0
304,samanthajojo7,1613370135,,happy,This is to amazing not to cross post. Found on r/humansbeingbros.. makes me happy cry.,https://i.redd.it/nvfzv2qudkh61.jpg,1613341335.0
305,SuugarIzGood4U,1613369818,,happy,"Finally, on Valentine’s Day I get a compliment, ( am doing long title because last one got removed due to short title)",https://i.redd.it/oe2sb57a3lh61.jpg,1613341018.0
306,SuugarIzGood4U,1613369744,,happy,"Finally, inner peace.",https://i.redd.it/lytmt4a23lh61.jpg,1613340944.0
307,minimalismemma,1613365834,"A trick I like to do when I need to be put in a better/ happier mood is looking up playlists that are uplifting and put me in a much happier mood. Especially when I'm feeling down. My favorite one so far is called ""sunshine indie pop"" on spotify. It is like positive indie pop music and I lovee love it!!! So whenever you're feeling down, listen to some happy music and you'll get put into a much better mood.",happy,Using a playlist to make me happy every single day!,https://www.reddit.com/r/happy/comments/lk6ctr/using_a_playlist_to_make_me_happy_every_single_day/,1613337034.0
308,slothsecretive,1613361925,"
this has been a dream of mine since I started playing video games ages ago. I started streaming 2 months ago and got affiliate and my first prime sub!! numerous times people have said that I can’t stream cause “I’m a girl” or that I’m a “nerd”",happy,I made my first $4.50 as a twitch streamer which is my dream job!!,https://www.reddit.com/r/happy/comments/lk59mo/i_made_my_first_450_as_a_twitch_streamer_which_is/,1613333125.0
309,slothsecretive,1613361812,[removed],happy,I made $4.50 as a twitch streamer!!,https://www.reddit.com/r/happy/comments/lk58j2/i_made_450_as_a_twitch_streamer/,1613333012.0
310,sarah_soda10,1613359915,,happy,Made a suet heart from bird feed for my bird friends for Valentine’s,https://i.redd.it/8msfp4ut9kh61.jpg,1613331115.0
311,HighIntoOrbit,1613356697,That shit felt good you know.,happy,I wasn’t alone on valentine’s day for once,https://www.reddit.com/r/happy/comments/lk3qe5/i_wasnt_alone_on_valentines_day_for_once/,1613327897.0
312,Gordondel,1613354797,,happy,It's not much but after 15 years of being an active musician in my country I'm the winner of a smaller category of our national music awards. It means so much to me!,https://i.redd.it/dh2gndgktjh61.jpg,1613325997.0
313,BushyEyes,1613354759,,happy,"I always love it when my dad texts me the paintings he's working on. Here are my favorites from the past 6 months or so. Ever since I was a kid, he painted nearly every day for 15-20 minutes and it makes me so happy to see him continue with his passion!",https://www.reddit.com/gallery/lk353o,1613325959.0
314,Supremestcumfish,1613353945,,happy,"Happy Valentine’s Day from my boy, Cooper!",https://i.redd.it/n3s5dby2sjh61.jpg,1613325145.0
315,mangulo321,1613353451,[removed],happy,Alone on Valentine’s Day,https://www.reddit.com/r/happy/comments/lk2qk7/alone_on_valentines_day/,1613324651.0
316,multipletrees89,1613347832,,happy,Happy Valentine’s Day!! 🥰❤️🤗 check out this decorated wheelchair accessible van! 😍,https://v.redd.it/ochyn3vv9jh61,1613319032.0
317,danmolson,1613347619,I was doing some garage clean out and came across old family tapes.  I made a little music video and surprised my wife and kids on Valentine's Day. [If I Could Turn Back Time](https://youtu.be/iISue-Wm48Y),happy,Family and memories are the true essence of life.,https://www.reddit.com/r/happy/comments/lk0xws/family_and_memories_are_the_true_essence_of_life/,1613318819.0
318,multipletrees89,1613347606,,happy,Happy Valentine’s Day! 🥰❤️😍,https://v.redd.it/d6vrbgc59jh61,1613318806.0
319,danmolson,1613347478,,happy,This trip down memory lane made me happy!,https://youtu.be/iISue-Wm48Y,1613318678.0
320,freggers99,1613346578,"I confessed the love to my best friend but she doesnt feel the same and  this makes me feel pretty unsatisfied. but on the other hand shes still my best friend,we talk about everything  and maybe the relation between us will be better than ever. 

sometimes you should care more about the little good things rather the big negative things!",happy,happines comes in many colours and sizes 😌,https://www.reddit.com/r/happy/comments/lk0lda/happines_comes_in_many_colours_and_sizes/,1613317778.0
321,bebbsbsbsbsbbz,1613343862,[removed],happy,I’m so thankful,https://www.reddit.com/r/happy/comments/ljzpqm/im_so_thankful/,1613315062.0
322,psychedelicvelocity,1613339764,,happy,So happy to work as a florist! This was my favourite Valentine's order to make today,https://i.redd.it/93kc3f0xlih61.jpg,1613310964.0
323,Aserebro,1613339388,[removed],happy,Стыдно но смешно,https://www.reddit.com/r/happy/comments/ljy96f/стыдно_но_смешно/,1613310588.0
324,DaddyOr,1613339230,"Need some thoughts from strangers.

I've always thought of myself as a happy guy (15) but recently I've been getting mood shifts in being happy with friends to the point of screaming with them in discord to just straight up tearing up for no reason. Doesn't help at all that i also got to lose my left nut from torsion so that kinda sucked but i wasn't as devastated as my parents when this happened. Im kinda confused with myself as i get sad and happy about the little things but the bigger things i seem to ignore or just not affect me as much. Is there like a way or tips on how to just control emotions way easier or something? Friends have just said the usual things like do different hobbies and hang out more but in the end, my days currently end with me just sobbing up a bit before bed then tomorrow happens to me like nothing happened. Others say im depressed but i don't think i am since im not really too sad or atleast im sure that its worse than what i have. Need thoughts from strangers here to add to what i should think about to improve myself.


And yes this is my hentai account, though i havent been able to do the deed as much and I've also gotten to the point where i get sad when reading wholesome doujins, its confusing really.",happy,Need some thoughts from strangers here about what i have right now.,https://www.reddit.com/r/happy/comments/ljy79s/need_some_thoughts_from_strangers_here_about_what/,1613310430.0
325,DaddyOr,1613339181,[removed],happy,Need some thoughts from strangers.,https://www.reddit.com/r/happy/comments/ljy6n9/need_some_thoughts_from_strangers/,1613310381.0
326,Prevasive,1613333988,[removed],happy,Birthday!,https://www.reddit.com/r/happy/comments/ljwfd3/birthday/,1613305188.0
327,Just_Justin_Right,1613332619,,happy,Ngl he got me lol. Alright bye 😁,https://youtube.com/shorts/crj_ByWMaXU,1613303819.0
328,dis_2much,1613331686,,happy,Finally getting back into photography thanks to my amazing girlfriend. Focusing on what matters most :),https://i.redd.it/jt1mdfrvxhh61.jpg,1613302886.0
329,CourtM092,1613326914,"I've been dealt a shitty hand. From sustained a severe brain injury when I was 21 (8 years ago) to developing mental health issues thanks to the TBI.

My fam was told I'd would live my life as a 13 year old. I would never walk independently or eat solid foods again. Well, I behave age appropriately. I walk just fine now. I even run! Regarding the food, I don't have a G tube anymore. I eat solid foods.

Present day. I enjoy helping people. I applied to work at a group home for peeps with neurological disabilities. I passed the interview with flying colors. Hopefully, I start in a couple weeks. I'm very excited to start.",happy,I just got offered my first full time job - ever!,https://www.reddit.com/r/happy/comments/ljty56/i_just_got_offered_my_first_full_time_job_ever/,1613298114.0
330,carrotcamera,1613322917,,happy,Got surprise snow for a present on my Valentine birthday!,https://i.redd.it/7wgz5oit7hh61.jpg,1613294117.0
331,Dojustly,1613322514,,happy,Doesn't even need Snow!,https://v.redd.it/rsp7mo5v5hh61,1613293714.0
332,YaBoiHippocampus,1613320289,,happy,I am happ e becaus of gorgflod!,https://i.redd.it/tmaua0900hh61.jpg,1613291489.0
333,bigfuckingdiamond,1613320123,,happy,My best friend appeared at my door with flowers for valentines. Feeling so loved &lt;3,https://i.redd.it/5z1a10yhzgh61.jpg,1613291323.0
334,davynels,1613319617,,happy,Family group text said “look outside” this morning...,https://i.redd.it/fmt6s860ygh61.jpg,1613290817.0
335,bigfuckingdiamond,1613318994,,happy,My best friend turned up at my front door with flowers because she knew I'd be feeling crap this valentines day. I feel so loved!! &lt;3,https://i.redd.it/p2dbt965wgh61.jpg,1613290194.0
336,Thorbort6969,1613315462,,happy,"Daily Thoughts 81. I am getting trained in the Line Cook Games. So, anything is possible friends.",https://i.redd.it/59mm12jnlgh61.jpg,1613286662.0
337,Dreadindian,1613315444,,happy,HAPPY VALENTINES DAY famiglia. Keep Smiling:)),https://i.redd.it/q480soollgh61.jpg,1613286644.0
338,magnificentlife505,1613312775,,happy,Powerful motivation quotes,https://youtu.be/Qs2h6mUCcvE,1613283975.0
