,author,created_utc,selftext,subreddit,title,url,created
97,is_it_corona_time,1613943224,"I was out with my dad riding bikes today when we recognized our neighbor. We said hello as we passed him, and as we did we noticed he had his young son with him on his own tiny little bike. It appeared to me that the little fella was just starting to learn how to ride his bike without training wheels.    
I can still remember, 20-odd years later, how elated I felt when finally achieving such a feat myself. So I called out to the boy as I passed by him and his dad, “Who needs training wheels when you’ve got superpowers? You can do it! Go for it!”    
Next thing Dad and I know, that little guy has the biggest smile on his face and he’s zooming off down the path like he’s known how all his life. His dad trotted off after him, throwing a thumbs-up back at me and my dad in thanks.    
I’m so proud of that little guy. No matter what he does or where he goes in life, I hope he always remembers that he’s got superpowers, and he can do anything he wants if he tries hard enough.",happy,Neighbor’s son rides his bike without training wheels!,https://www.reddit.com/r/happy/comments/lp77ge/neighbors_son_rides_his_bike_without_training/,1613914424.0
98,is_it_corona_time,1613943118,[removed],happy,Neighbor kid rides like the wind,https://www.reddit.com/r/happy/comments/lp7642/neighbor_kid_rides_like_the_wind/,1613914318.0
99,CodBlowsDogs4qtrs,1613941479,"So I got myself a fan base of stalkers! People thought I was a ghost or a spook or something, but none of which are true. I enjoy my job in retail and love helping people, always have my entire life. I've had the luxury of putting faces with names along with their voices and speech patterns into the back of my brain. What has intrigued me the most is their dedication to watch. Got to hand it to you all actually, the persistence is almost.... palpable. Glad you all made me smile the last few months, because for awhile, I almost felt dead inside. Love you all and be safe out there! 😘😘😘 

PS: thank you for making me a better person. 

Sincerely, 
A.",happy,Got my own fan base of colorado stalkers!,https://www.reddit.com/r/happy/comments/lp6lqf/got_my_own_fan_base_of_colorado_stalkers/,1613912679.0
100,JohnnyIOnut,1613940599,"I am usually a very negative person and see the empty half of a glass. But not today. Today I had a pretty decent day and I feel very good with myself. 
I know it sounds stupid but don't want this feeling to ever leave. I am at peace with things and I feel like I can really do things I want. I usually get this bursts of good emotions but they usually wear off in a day or two. How to keep a positive attitude and feel like this more often?",happy,How to be happy more often as a negative person,https://www.reddit.com/r/happy/comments/lp6an9/how_to_be_happy_more_often_as_a_negative_person/,1613911799.0
101,JohnnyIOnut,1613940538,[removed],happy,How to be happy?,https://www.reddit.com/r/happy/comments/lp69wv/how_to_be_happy/,1613911738.0
102,CocoCookieDraws,1613939447,,happy,"This is my first digital fanart, of Claire Nunez from Trollhunters. I just feel so happy every time I look at it, especially looking at the texture of her shadowstaff. What do you think?",https://i.redd.it/esmm031r4wi61.png,1613910647.0
103,Dragonair_fruit1371,1613935900,"So basically last year I was feeling a bit low. I really didn’t know how to become better since I had never faced this before. So I just started noting what activities I did and whom I did it with in a google doc. Slowly I also started rating how I felt about the interaction. Soon I started to notice a pattern that I felt better when I hung out with some people and when I did certain activities. This way I was able to feel much better than before and I gained confidence that I can control my own mental health. I even built an app for this so that other people can do the same .

The app is called **Happyer** which was made based on the above experience and provides insights into impact of a given activity or friend.

[https://play.google.com/store/apps/details?id=com.happyer4life](https://play.google.com/store/apps/details?id=com.happyer4life) for android [https://apps.apple.com/ca/app/happyer/id1537711110](https://apps.apple.com/ca/app/happyer/id1537711110) for iOS.",happy,I was not happy but then I worked to improve my mental health and ended up making an app for everyone!,https://www.reddit.com/r/happy/comments/lp4lcs/i_was_not_happy_but_then_i_worked_to_improve_my/,1613907100.0
104,JayBeeAllen,1613935594,,happy,Who here loves and appreciates these kind of laughs with friends and family? They are my favorite :),https://i.redd.it/3waps7yltvi61.jpg,1613906794.0
105,deedee2100,1613934979,,happy,Wanted to make it a little less depressing to work from home :),https://i.redd.it/ldnv7lrrrvi61.jpg,1613906179.0
106,anthonytrainer,1613931264,,happy,Work for your dreams and goals but still value those around you.,https://i.redd.it/fulfp11rgvi61.jpg,1613902464.0
107,Pyrojodge,1613926456,,happy,So I work for the company that makes this possible. I've been helping on this for the past few years... I hope for a speedy recovery for those in need but its great to see how this technology helps people! https://www.foxbusiness.com/lifestyle/ford-trucks-generators-texas-homes-winter-storm-power-,https://i.redd.it/x80pnp9g2vi61.jpg,1613897656.0
108,sauvandrew,1613923279,,happy,Good Morning from the sunny shores of Lake Ontario!,https://i.redd.it/hfvc2f20tui61.jpg,1613894479.0
109,Infinitianss,1613916996,"Hop on and read the guaranteed path to success here:

[https://infinitians.com/this-is-the-guaranteed-path-to-success/](https://infinitians.com/this-is-the-guaranteed-path-to-success/)",happy,"The two extreme paths which are gonna lead to guaranteed failure in life are: #1 Thinking without Action &amp; #2 Action without Thinking; More than 99% of all the people are consciously or unconsciously, walking on either of the two paths, which is why they are unsuccessful.",https://www.reddit.com/r/happy/comments/loxxlk/the_two_extreme_paths_which_are_gonna_lead_to/,1613888196.0
110,Distinct_Mark,1613916025,,happy,I’m finally ready to launch🚀!!! My on-line course in Dual Brain Rational Behavior Therapy🤗!!! (How to be Happier and Much Less Disturbable) See comment section for info.,https://i.redd.it/5kk77xsf7ui61.jpg,1613887225.0
111,uvuvwevwevweugwembe,1613915312,"I am 17, soon 18, and for the first time in a long time, I can feel joyful and relaxed without forcing it. I can feel genuine happiness.

I am the most productive I have ever been in my life: I spend around 8 - 10 hours reading, writing, listening to podcasts, education, research, etc. every day (with breaks in between, of course). 

It has taken me a year, but I've learned self-love. I attempt to treat myself as someone I am responsible for helping - that's another way to put it.

I have finally cracked to code to what's wrong with me and I am getting professional help. Finally knowing I have BPD, depression, emotional disturbances, and PTSD, I can rest and begin improving myself mentally. This took some misdiagnoses and a lot of suffering before it all clicked.

This couldn't be a better way of turning 18! I am really happy! Just wanted to share it here.",happy,I am legitimately starting to experience and see the joy in life again!,https://www.reddit.com/r/happy/comments/loxf32/i_am_legitimately_starting_to_experience_and_see/,1613886512.0
112,outlander345,1613912406,,happy,"After a year of depression and gaining 10 pounds, I have been tackling my diet for the past 3 weeks thanks to this magazine. I have made all my meals based on this and and I love looking forward to the week and organizing my kitchen to accommodate my leftovers/ingredients. It's the small things!",https://i.redd.it/vfzmbfxnwti61.jpg,1613883606.0
113,LongNectarine3,1613907148,"I wear my mask as I walk. I like it because of the cold weather, and the smiles the elderly give me. I also am able to give a good six feet to walk around anyone. 

Today I was enjoying my tunes on my new earbuds. My first new thing I have bought myself in years (mom). I love them.

Well on this wall a man with a larger bulldog tries to approach me. I have a pug and a puggle. 2 small dogs. He was using his size and the size of his dog to cross my 6 foot boundary. He then starts to talk to me without a mask on. I am obviously uncomfortable so I back up and dial my SO. (A trick I learned to politely end a conversation with someone being overly aggressive). The minute the guy heard his voice he backed off and left. But not before I knocked out my earbud.  This made me break down in tears. I just wanted to walk my dog.  

I was frantic looking for it as my SO pulled up to pick me up. It was white though and everything was white. After an hour, even when he soon joined me, I could not find my precious gift to myself, that silly wireless earbud. 

I was inconsolable. So he has driven me down to the store and is getting me a replacement. He doesn’t make much so this is a huge gift. My Prince Charming. 


Happy ending.",happy,My husband proved to me today that it’s the small things that keep our love alive,https://www.reddit.com/r/happy/comments/lovb63/my_husband_proved_to_me_today_that_its_the_small/,1613878348.0
114,LongNectarine3,1613906237,[removed],happy,I am in love,https://www.reddit.com/r/happy/comments/lov3a2/i_am_in_love/,1613877437.0
115,Astronomy_Astronaut,1613899459,[removed],happy,Help I can't feel happiness,https://www.reddit.com/r/happy/comments/lothkd/help_i_cant_feel_happiness/,1613870659.0
116,sabukottotty,1613888407,,happy,ഈ തള്ള് നിങ്ങളറിയാൻ വേണ്ടി തന്നെയാണ് - You know...,https://youtube.com/watch?v=f6e5MfWaqWs&amp;feature=share,1613859607.0
117,Glitter-Ghost6969,1613886661,[removed],happy,My gf and i bond most over video games.,https://www.reddit.com/r/happy/comments/loqah0/my_gf_and_i_bond_most_over_video_games/,1613857861.0
118,Doont_ta_doont,1613880271,Repost with better title.  I just put on a rocking karaoke show for my dogs.  I haven’t let loose like this in a while and it felt really great to sing!  I recently moved from the city so there are no nearby neighbors to bother anymore.  Singing makes my soul happy!,happy,Singing Karaoke at home lifts my spirits!,https://www.reddit.com/r/happy/comments/loojlj/singing_karaoke_at_home_lifts_my_spirits/,1613851471.0
119,Doont_ta_doont,1613880090,[removed],happy,Singing my heart out!,https://www.reddit.com/r/happy/comments/loohnf/singing_my_heart_out/,1613851290.0
120,last_goodbye1,1613877482,"So, let me start from the beginning. My dad walked out on me and my mom when I was four, my sister was two. My mom just couldn't balance work and having to take care of us, so we all lived with my grandparents (her parents) until I was six. It was a pretty normal and fun time, though I don't remember much about it. Eventually, my mom got her life together more and had a high enough paying job to get us a townhouse, and that's where I grew up all the way until college. 

But now my aunt and uncle (mom's brother) come into the picture. When I was 10, my cousin that I was excited to meet was unfortunately stillborn. It...it shattered our family. Though it seemed to shatter my aunt the most because she repeatedly tried to take her own life and had to be institutionalized and receive psychiatric care. During that time, my uncle also slowly deteriorated mentally and rarely talked to us anymore. 

But one weekend, about a year later, I took it upon myself to visit him. He was basically half drunk and depressed but was nonetheless surprised to see me, in a good way. I just kind of talked to him about my life and what sports I was doing at the time and boys and all that boring stuff. But it wasn't boring to him. I eventually brought up Sarah (their daughter that was stillborn) and he immediately was getting ready to shut down, but I reassured him that he and my aunt would have been great parents, and he broke started crying a bit. 

But then I started breaking down and crying my eyes out because I didn't want to lose him. He hugged me tight and, apologizing for being the way he was, called me ""baby girl"". I don't know why, but being called that with such genuine love and affection made me cry happy tears. 

Things got better between us after that and he started showing up for more of my games, drove me to school in the winter instead of having to wait for the bus, and we visited my aunt more often (and my mom and sister came too) and she was slowly getting better also, finally leaving at the end of that year and she hasn't attempted to harm herself again. 

My uncle was like the dad I never had in a lot of ways. And me being around made him feel like a proper father but also gave him purpose in life again. He's told me before he was extremely close to ending it because he just didn't know what to do with himself anymore. I love him so much",happy,My uncle turns 55 today. He's told me before that I was the reason he kept living,https://www.reddit.com/r/happy/comments/lonr4n/my_uncle_turns_55_today_hes_told_me_before_that_i/,1613848682.0
121,Icy_Peak3403,1613877404,[removed],happy,I am Beautiful!!!!,https://www.reddit.com/r/happy/comments/lonqc0/i_am_beautiful/,1613848604.0
122,AnonZap,1613876876,,happy,Always smilin' 🤩,https://i.redd.it/adstqyq0zqi61.jpg,1613848076.0
123,[deleted],1613876427,[deleted],happy,Celebrating three years!,https://i.imgur.com/9xG6mty.jpg,1613847627.0
124,[deleted],1613870989,[deleted],happy,8 months sober from Xanax. 2021 vs 2020.,https://www.reddit.com/gallery/lolvpn,1613842189.0
125,Inazumaryoku,1613870391,,happy,"Adulting 101: Filing our taxes for the first time today! City office is open on a Sunday, we turned it into a date.",https://i.redd.it/5u4zs9xpfqi61.jpg,1613841591.0
126,Phillyfan1988,1613869951,,happy,Interracial Indian &amp; Spanish Couple: How We Met video makes me happy to see how we can continue to unite.,https://youtu.be/LHG4hrDGSgA,1613841151.0
127,LegoPoppin,1613869505,"I haven't had the best luck when it comes to relationships but I think I finally found the one who I actually love with all my heart.

I (23f) have been dating my SO (23m) for over a year now and it's been the best year of my life. I've never felt this happy or this comfortable or felt like I actually mattered in a relationship before and I'm still not used to it. Even though I'm not used to it I love the feeling of being on cloud nine and having my heart flutter everytime he message me or compliments or tells me how lucky he is to have someone who cares about him as much as he cares for me. I'm unconditionally in love with him and I want to show him how much he means to me every day and spend the rest of my life with him. 

I've never felt this appreciate it that I actually matter to someone before and it feels good he is the one person I want to tell everything to and is honestly my best friend! I can be my weird dorky self around him and he finds it cute, he makes me laugh and smile until it hurts (in a good way) I constantly think of him and have dreams of him when I fall asleep each night! I imagine what it would be like to move in with him and to get married to him and what our kids would look like, which is totally out of character for me because before I met him I never wanted to get married or have kids of my own! 

I definitely feel like it was destiny that we met as cliche as that sounds but honestly at this point I dont mind he is my soulmate and I believe we were ment to find eachother and spend an eternity with eachother.

I'm just so in love that I ache to be with him and I miss him every second of every day that we can't see eachother in person due to what's going on in the world at this moment. 

I don't know how to handle feeling like this!  Any advice?

TL;DR - I just wanted to express how I feel about my SO",happy,I found the person I want to spend the rest of my life with,https://www.reddit.com/r/happy/comments/lolfko/i_found_the_person_i_want_to_spend_the_rest_of_my/,1613840705.0
128,[deleted],1613869392,,happy,I found the one,https://www.reddit.com/r/happy/comments/loleag/i_found_the_one/,1613840592.0
129,[deleted],1613866191,[deleted],happy,Spent a money on myself and couldn't be any happier,https://www.reddit.com/r/happy/comments/lokec0/spent_a_money_on_myself_and_couldnt_be_any_happier/,1613837391.0
130,breakersounds,1613862133,,happy,Today was the first time since I was prescribed adderal at seven y/o that I went 365 days without amphetamines.,https://i.redd.it/8sbgg9t6rpi61.jpg,1613833333.0
131,[deleted],1613861977,[deleted],happy,After being prescribed Ritalin at 7 and subsequently being on adderall until I was 17.,https://i.redd.it/k1hv813qqpi61.jpg,1613833177.0
132,Emotional_Pen_1095,1613854554,How many karma do you need to post to promote onlyfans,happy,How to get more karma have 82 want to post on onlyfans,https://www.reddit.com/r/happy/comments/loghxv/how_to_get_more_karma_have_82_want_to_post_on/,1613825754.0
133,_literaryexpress_,1613848912,,happy,"Speaking exclusively to The Literary Juggernaut, author Robert Stubblefield, who is currently residing in Maryland, the US, says poetry has always helped him express his feelings towards the world around him. [INTERVIEW]",https://literaryjuggernaut.org/2021/02/18/rescued-by-poetry/,1613820112.0
134,minimalismemma,1613848394,Today I am starting 100 days of happiness. I am purposefully looking for one thing each day that makes me happy. Every single day. Today I am happy and grateful for the juicer my mom bought me. I made a really yummy juice this morning. Simple I know. But still makes me happy.,happy,The 100 days of happiness challenge: DAY 1,https://www.reddit.com/r/happy/comments/loeb3s/the_100_days_of_happiness_challenge_day_1/,1613819594.0
135,emmmarrd2,1613846683,,happy,I've been wearing glasses since I was 8 years old and have always been severely short-sighted. I just got laser eye surgery and now have 20/20 vision. I cried the first time I realized I could see all the leaves in the trees without my glasses. It's a good day.,https://i.imgur.com/SwEbdrir.jpg,1613817883.0
136,ashtraybutt,1613845464,,happy,When you find the one so you delete all your apps.,https://i.redd.it/z4a8e4cmdoi61.png,1613816664.0
137,Ok_Jaguar_5113,1613844512,,happy,Happiest day of my life next to my wedding day. Last student loan payment.....16 years after graduation.,https://imgur.com/a/7r4eszg,1613815712.0
138,geetp007,1613842134,,happy,Finding happiness in little things 🍁,https://youtu.be/PDHNsKpMqtI,1613813334.0
139,anthonytrainer,1613841357,,happy,I focused so much on perfectionism but forgot what I could do consistently. You’re special and there is no one like you. It is so easy to compare your level to someone’s best. Remember that you’re one of one.,https://i.redd.it/bouftzte1oi61.jpg,1613812557.0
140,LylaDee,1613837931,,happy,My kiddo is a little in love with Bob Ross. This is on her nightstand and her painting of PeaPod in his pocket makes me smile every time.,https://i.redd.it/iddzcsz7rni61.jpg,1613809131.0
141,shrouk98,1613837272,,happy,A happy moment for me (seeing Akhenaten’s coffin for the first time after being obsessed with it)!,https://i.redd.it/rhohip99pni61.jpg,1613808472.0
142,Gollum_Reads,1613834423,,happy,"GOLLUM READS, Children's Books | Does a Kangaroo Have a Mother, Too?",https://i.redd.it/luzgtopldni61.jpg,1613805623.0
143,Infinitianss,1613830525,"Read this article and start living happily!

[https://infinitians.com/this-is-how-you-can-live-happily/](https://infinitians.com/this-is-how-you-can-live-happily/)",happy,"Whenever we are morose, then that generally means our thinking is not aligned with reality. And instead of working upon our thinking, we are busy altering the situations and people. We never work on the real cause of all the sadness we have in our lives. Our THINKING. Let's change it to live happily",https://www.reddit.com/r/happy/comments/lo7ypp/whenever_we_are_morose_then_that_generally_means/,1613801725.0
144,vrushtimody,1613822281,[removed],happy,I am covid positive and the love I've recieved from my boyfriend kinda makes the quarantine not that bad.,https://www.reddit.com/r/happy/comments/lo5p2o/i_am_covid_positive_and_the_love_ive_recieved/,1613793481.0
145,vrushtimody,1613821966,[removed],happy,"Me: 1, Covid: 0",https://www.reddit.com/r/happy/comments/lo5me5/me_1_covid_0/,1613793166.0
146,fortwangle,1613821371,,happy,My husband and I bought our first home! We have always lived in large cities but had to move for work. Decided to go all out on a four acre property (with a pond!) I am so happy to find the perfect home for my family.,https://www.reddit.com/gallery/lo5hak,1613792571.0
147,Ninichimusic,1613820107,,happy,Uplifting and relaxing playlist - Jazzy Times,https://open.spotify.com/playlist/3GimQjsntBgQxWoiYbh9Pk?si=r0PsDLD7SDKGmQoz8Bdn2g&amp;utm_source=copy-link,1613791307.0
148,opf999,1613807716,"Can be anything from rap to pop. Old or new, as long as it makes you feel happy comment it. I’m tryna make a good happy feels playlist.",happy,What are your favorite happy/upbeat songs?,https://www.reddit.com/r/happy/comments/lo2clh/what_are_your_favorite_happyupbeat_songs/,1613778916.0
149,deadfermata,1613803638,"I'm glad it happened successfully especially in the midst of a global pandemic. The human species really pulled through and it gave us a glimmer of hope that in the midst of all the problems we have, some of us are looking beyond to the future and to science and to things beyond this literal world. 

For the Perseverance rover, I love how you have thousands of really really smart engineers and scientists and designers and mission control folks and also all the counter labor workers who maintain these facilities all playing a role in building this incredible machine...

...and it all comes down to a kid. a single kid kid out of 7 billion humans gets to name it to inspire the next generation of scientists and engineers. It's pretty touching and pretty selfless of all those people to let a kid name their creation that they spent years building up and supporting and worked on. It's like you having a baby but it gestates for years and then you give a random kid the opportunity (pun) to name that baby after all this time you spent creating and building it up and maybe even loving it.

humanity is wonderful. this is the best of us, folks.",happy,I'm really happy about Perseverance landing!,https://www.reddit.com/r/happy/comments/lo1ea2/im_really_happy_about_perseverance_landing/,1613774838.0
150,imavegetarian,1613798348,[removed],happy,I am in love.,https://www.reddit.com/r/happy/comments/lo00ql/i_am_in_love/,1613769548.0
151,BlimBlaam,1613791229,,happy,Landed my dream job after the long struggle. I am now officially a Longshoreman in the ILA.,https://i.redd.it/ylcqqpkcwji61.jpg,1613762429.0
152,mkligman,1613790818,,happy,I saw a bunch of signs for this missing teddy bear. I found it online and ordered it. It’s fun to solve mysteries and make people happy.,https://www.reddit.com/gallery/lnxtx3,1613762018.0
153,VelvetMerryweather,1613786391,"I've been feeling very old, ugly and dowdy lately. I don't know how to style my hair, or wear makeup. I'm starting to try a little more, but wasn't convinced it was helping.  Today I randomly decided to buy some beer while shopping, and when the lady at the register checked my ID (which some don't anymore), she said ""Girl, I NEVER would have guess that!"" And it seems silly, but it meant a lot to me.",happy,"A Walmart employee who mans the self checkout just made my day. She was in a wheelchair, and you know.. working for Walmart, but she still had a lot of positive energy to give. And I needed that.",https://www.reddit.com/r/happy/comments/lnwgja/a_walmart_employee_who_mans_the_self_checkout/,1613757591.0
154,VelvetMerryweather,1613785995,[removed],happy,Thank you nice walmart lady!,https://www.reddit.com/r/happy/comments/lnwc0v/thank_you_nice_walmart_lady/,1613757195.0
155,Complete-Feedback-13,1613781771,,happy,lets see,https://i.redd.it/tfwrvz664ji61.jpg,1613752971.0
156,the_small_one1826,1613779248,Still waiting on other unis and I have to maintain a pretty high average but!!!!!!!!!,happy,I just got into university and got a $3500 scholarship!,https://www.reddit.com/r/happy/comments/lnu46q/i_just_got_into_university_and_got_a_3500/,1613750448.0
