,author,created_utc,selftext,subreddit,title,url,created
157,pixieorfae,1613777929,"I am so happy right now. I love my friends, I love my family, I get on amazingly well with my dad and we've gotten even closer since he's been working from home, and my little sister is growing up enough that I can introduce her to all my favorite things (The hunger games!! Buffy!!) And my Mum taught me to crochet!

It's at the point in lockdown where we are finally seeing a little hope on the horizon and I've had enough amazing experiences and made so many awesome memories that I am not struggling with this lockdown nearly as much as the first!

I'm happy with the way I look, even though I'm still working on my relationship to food it is getting BETTER!!

I'm happy with my recent exam results and I'm all set to go to sixth form college in September to study something I love and have a good chance in (acting) and my family and friends have been nothing but supportive.

I'm saving up for a nintendo switch lite and have been going to work with my mum as a gardener! My animals are tame and friendly and, honestly, although sometimes life can be hard, and bits of it suck, and people annoy you and there are dark patches, I am so HAPPY to have come through the other side of all mine and I can truly say, for the first time in a long while, I am back to being my truly happy self.",happy,I freakin' hecking blimmin love my life!!,https://www.reddit.com/r/happy/comments/lntnsu/i_freakin_hecking_blimmin_love_my_life/,1613749129.0
158,mkligman,1613776067,,happy,Lost &amp; Found,https://www.reddit.com/gallery/lnszw7,1613747267.0
159,LuveSchuki,1613772278,"Short story for you. We lost our parents and our grandma 3 years ago. So me and my grandpa take care of my brother. I do all the homework and cooking stuff for my lil family now. 

Today he got his notes from the teacher and sie told him he is the best this year. He was so happy. He smiled all day. I didnt remember when he looked so careless since our family died. He is in the 6th grade now. 

He called me bc i was working and when he told me that, i started crying. I am so proud! He always had so problems at school but now he is doing so well. 

My god... i really believe that our parents and granny would be proud of us aswell!",happy,Today I (f22) cried bc my lil brother (m12) became best in class.,https://www.reddit.com/r/happy/comments/lnrmoo/today_i_f22_cried_bc_my_lil_brother_m12_became/,1613743478.0
160,aamnipotent,1613771432,"I dont know if I'll take it yet but Ive been job hunting for like 3 years and really losing patience but today I got an offer from a great company, great pay and benefits and I dont have anyone to celebrate this with so I am.just proud of myself that all my hard work paid off!",happy,I got the job!!!,https://www.reddit.com/r/happy/comments/lnrb11/i_got_the_job/,1613742632.0
161,JohniiMagii,1613767596,[removed],happy,My honeymoon was magical,https://www.reddit.com/r/happy/comments/lnq391/my_honeymoon_was_magical/,1613738796.0
162,Thorbort6969,1613765428,,happy,"Daily Thoughts 86. If this looks amazing, then so do you. You don’t need company for your worth.",https://i.redd.it/leom8tmlrhi61.jpg,1613736628.0
163,mel_mance,1613765113,,happy,Finally got out of my depression rut and felt motivated to finish 3 projects that were sitting unfinished in my office. Feeling very proud of myself today and had to share it with someone,https://i.redd.it/eo5h6tooqhi61.jpg,1613736313.0
164,Sabaspep,1613764269,,happy,My buddy covered up his proud boy tattoo.,https://i.redd.it/ai00o5l2ohi61.png,1613735469.0
165,mckinnos,1613758302,,happy,I just successfully defended my dissertation and my nails looked awesome!,https://i.redd.it/rsaid9xf6hi61.jpg,1613729502.0
166,Infinitianss,1613756267,"Listen to the audio version here:

[https://www.youtube.com/watch?v=0ldzADNvays](https://www.youtube.com/watch?v=0ldzADNvays)",happy,This is how you can get rid of negative thoughts,https://www.reddit.com/r/happy/comments/lnlo41/this_is_how_you_can_get_rid_of_negative_thoughts/,1613727467.0
167,misstterr_a,1613756065,,happy,2 SIMPLE QUESTIONS 1) Have you ever never compared yourself with anyone in all your life? 2) Have you ever stopped comparing yourself with others completely?,https://youtu.be/h__vqRcgFyk,1613727265.0
168,misstterr_a,1613755823,,happy,Do not compare yourself,https://youtu.be/h__vqRcgFyk,1613727023.0
169,Trolololman399,1613751851,,happy,First walk in nearly 3 months. Feels good man,https://i.redd.it/owx5xy99ngi61.jpg,1613723051.0
170,copisautx,1613749772,,happy,"I’ve erased 100 titles by now because nothing can explain how happy I am. Four years of trying to figure out how to be an utterly single mom, homelessness, and living in my car, we finally moved into a real home. Obligatory floor pizza on the first night",https://i.redd.it/9vvr5xcrqr321.jpg,1613720972.0
171,ComprehensiveWeb8906,1613748872,[removed],happy,Love life,https://www.reddit.com/r/happy/comments/lninm2/love_life/,1613720072.0
172,HockeyRepair,1613743738,,happy,It’s the little moments of silliness that makes it all easier these days...,https://i.redd.it/ic44xnl4zfi61.jpg,1613714938.0
173,[deleted],1613743600,[deleted],happy,It’s the little things.,https://i.redd.it/pb0bj8xpyfi61.jpg,1613714800.0
174,Rich-1234,1613742706,,happy,Eight years ago I decided to take a big risk and set up my own company. Yesterday we were on the BBC 😄......Hundreds of stone age tools found on Denbighshire housing site,https://www.bbc.co.uk/news/uk-wales-56106312?at_campaign=64&amp;at_custom3=bbc_wales_news&amp;at_medium=custom7&amp;at_custom1=%5Bpost+type%5D&amp;at_custom2=facebook_page&amp;at_custom4=7C8F6E82-716D-11EB-906F-64B4923C408C,1613713906.0
175,houseflow13,1613739345,,happy,"After several years,I curated this epic House Music playlist.I put a lot of passion as I always was extremely picky for the right track, from Deep House, Progressive, Tech House and Electro. My only purpose is that people get to know and love House music! I hope you Enjoy it!!",https://open.spotify.com/playlist/2JPzPB9jnvJLAYtmCbvZy8?si=VTzVLMMSSEanIeQJ1nnPeg,1613710545.0
176,Raymond423242,1613732854,[removed],happy,How To Arrange Your Entrance,https://www.reddit.com/r/happy/comments/lndczi/how_to_arrange_your_entrance/,1613704054.0
177,LWslipmat2020,1613731150,,happy,Funny Poodle doesn't like winter in the UK,https://youtu.be/_TE6EmSi4eI,1613702350.0
178,barathonucmnm,1613728984,,happy,"In 3 days I leave for Drum Corps! For those unfamiliar- it's essentially professional marching band. We will rehearse 12 hours a day for a month, then tour the country for the rest of the summer!",https://i.redd.it/g1hcyobfywz01.jpg,1613700184.0
179,Johannaof,1613727347,,happy,I’m still working out 💪🏻 Day 5 is coming 🤩 Can I motivate anyone to get active? ☀️,https://i.redd.it/yylew49emei61.jpg,1613698547.0
180,[deleted],1613720471,[deleted],happy,My girlfriend (who goes to school an hour away) falls asleep on FaceTime all the time. I’m just a really lucky and happy guy.,https://i.redd.it/bykl82cy1ei61.jpg,1613691671.0
181,multipletrees89,1613713829,,happy,Taking out the recycling in my building... I noticed someone must have turned three! Awesome patents whoever they are 😎🎉🤩🎂,https://i.redd.it/h4e50g37idi61.jpg,1613685029.0
182,multipletrees89,1613713746,,happy,Taking out the recycling in my building... I noticed someone must have turned three! Awesome patents during Covid whoever they are 😎🎉🤩🎂,https://i.redd.it/4bczu1cyhdi61.jpg,1613684946.0
183,Thick_Application_47,1613710445,I got hungry and realized I left some cheeze itz in my bedroom the perfect midnight snack. I turn around in bed to get up and find them and they were right there. It was just such a satisfying feeling they were right there what a good way to end the day. Except I should brush my teeth afterwards.,happy,When your subconscious and conscious are somehow in sync to provide you cheese itz,https://www.reddit.com/r/happy/comments/ln76dm/when_your_subconscious_and_conscious_are_somehow/,1613681645.0
184,Thick_Application_47,1613710265,[removed],happy,Cheeze itz in a bowl,https://www.reddit.com/r/happy/comments/ln74c5/cheeze_itz_in_a_bowl/,1613681465.0
185,Beary777,1613708532,,happy,:D,https://i.redd.it/9bismlpb2di61.png,1613679732.0
186,Chaddiz,1613706298,She just started a blog about us and she's freaking out over me and her mom subscribing to it and it's so cute ! 😂😍,happy,My wife getting excited over 3 followers on her blog makes me so happy.,https://www.reddit.com/r/happy/comments/ln5t9n/my_wife_getting_excited_over_3_followers_on_her/,1613677498.0
187,krzykttn,1613702442,,happy,"I've had a really tough few months. I was able to sculpt a snow queen today due to crazy southern weather patterns. I find her thick self so lovely, as I have learned to love my form! Please see her as art, not vulgar!",https://www.reddit.com/gallery/ln4jdn,1613673642.0
188,Kerr-rawden,1613701576,,happy,"I found a lost seal and babysat it, making sure it was OK, and highlighting how to rescue abandoned seals if you find them",https://youtu.be/pDXdpRmg9Mc,1613672776.0
189,Kerr-rawden,1613701364,,happy,How to rescue an abandoned seal pup!,https://youtu.be/pDXdpRmg9Mc,1613672564.0
190,mslowkii,1613696267,,happy,"Was feeling down about my looks, but I felt so happy after taking a bunch of selfies with some makeup! ✨",https://i.redd.it/8z6nw53z1ci61.jpg,1613667467.0
191,worldsokayestmiddle,1613694841,[removed],happy,i am happy oOoOoOo vague title 😳😳😳,https://www.reddit.com/r/happy/comments/ln1ywa/i_am_happy_ooooooo_vague_title/,1613666041.0
192,worldsokayestmiddle,1613694782,[removed],happy,i am happy,https://www.reddit.com/r/happy/comments/ln1y3h/i_am_happy/,1613665982.0
193,ShopYourSook,1613694673,,happy,"To help small businesses compete with Amazon, I built a free plugin that shows you local alternatives for products when you're shopping online. It's been tough doing it by myself, but I saw an uptick in downloads &amp; found out this awesome guy made the case for it on Tik Tok better than I can!",https://v.redd.it/n8vrg6h3xbi61,1613665873.0
194,hadesteansare88,1613691309,,happy,"My mugshot from two years ago following a massive PCP/benzo overdose and before homelessness and a trip to prison. I'm now two years sober, living a wonderful life and happier than I ever thought I'd be!",https://imgur.com/jFCqWRE,1613662509.0
195,Ahesil,1613691100,[removed],happy,I got a $3 tip at work today,https://www.reddit.com/r/happy/comments/ln0m9k/i_got_a_3_tip_at_work_today/,1613662300.0
196,bored_M_throwaway,1613689948,,happy,"#summer 2019 my kid found this on the beach and brought it home. I told him to get rid of it. With the way everything is now, I look at this and smile all the time. I'm glad he saved it.",https://i.redd.it/xc5mkqz6jbi61.jpg,1613661148.0
197,SonOfMcGibblets,1613687449,,happy,Feeling proud that I was able to fix my furnace on my own,https://i.redd.it/c5d1rwzqbbi61.jpg,1613658649.0
198,chansthemangm,1613687230,,happy,My birthday was always the most depressing time of year for me. I was always alone and miserable. Last night my friends threw me a surprise party and showered me with love. It feels really good to be genuinely happy and loved. I hope I never lose this feeling.,https://i.redd.it/nnlidwx0plzz.jpg,1613658430.0
199,SonOfMcGibblets,1613686184,,happy,I fixed my furnace!,https://i.redd.it/nhsbhu208bi61.jpg,1613657384.0
200,OmikronRex,1613685395,,happy,Her first cappuccino ever! Then she added to it like 8 spoons of sugar,https://v.redd.it/nz9jazed5bi61,1613656595.0
201,Earlybp,1613684788,,happy,It may not seem like much but I used a chain saw for a first time and cut up this mesquite!,https://i.redd.it/dco9kjut3bi61.jpg,1613655988.0
202,Oliver_New,1613683515,"[Modern Indie/Alternative/Rock](https://open.spotify.com/playlist/6JwCdo2OW3ZTvWKdmnrvZ7?si=Z-E1EXzwS3a29VXTHFB1CA&amp;utm_source=copy-link) - really proud of this one, has lots of fantastic up and coming bands and artists from all over the world

[Profound Lofi Beats](https://open.spotify.com/playlist/672c1lJNTVyST6zsgsfb8u?si=YH5Vwfo3TySdsr0LUXo3aw&amp;utm_source=copy-link) - these Lofi beats are slightly more intricate and unique than the main Lofi beats playlists on Spotify

[Modern Acoustic/Gentler Music ](https://open.spotify.com/playlist/3b1IgX4fNB0sHG3VOtZW8p?si=z8PS3l5qRdmwEiCb0gCdCQ&amp;utm_source=copy-link) - This playlist has many independent musicians who create softer music, good to listen to on mellow weekends/evenings

[Modern Electronic/Dance Tunes](https://open.spotify.com/playlist/4AC49FwKIR7WqNfEcVIJfm?si=amL6zxxOSMq79_FrPvUAvA&amp;utm_source=copy-link) - This one a wide array of Electronic music, incredibly diverse ranging from upbeat to mellow and some great Independent artists here!

[Lofi beats to chill and spin flax to](https://open.spotify.com/playlist/4Q2MIsPUQxbWq6mxm200da?si=ykp1vrLAR_mVFCV8BtRjGQ&amp;utm_source=copy-link) - bit of a jokey/meme playlist I made for playing RuneScape, a long list of Lofi beats for long gaming sessions! 

[Lofi Recline](https://open.spotify.com/playlist/4u6bKqrYkX1JHCASM2bFIY?si=7faZEpCjTWSSSWbvbbFDlA&amp;utm_source=copy-link) - much more peaceful evening lo-fi, good to be rid of overthinking and settle in for a peaceful night

[Really Funky Jams](https://open.spotify.com/playlist/18RNDvvvHbg4LIG9Jd81yh?si=r0cUxFFzSj-zxXjW5cSRxQ&amp;utm_source=copy-link) - cool to go a bit mental to and dance around the room and feel that funk",happy,I'm an independent artist/playlist curator and I listened to 600 independent unsigned artists' submissions and added the best to my range of Spotify playlists below. Posting here for anyone who's interested in some totally fresh music away from mainstream stuff and a wide range of genres,https://www.reddit.com/r/happy/comments/lmxpfm/im_an_independent_artistplaylist_curator_and_i/,1613654715.0
203,366m4n89,1613681318,[removed],happy,I got a job!,https://www.reddit.com/r/happy/comments/lmwtk6/i_got_a_job/,1613652518.0
204,theKFP,1613680504,,happy,My little boy (15 months) is learning to fork and is pretty proud of himself!,https://i.redd.it/e0fkz103rai61.jpg,1613651704.0
205,smileeb,1613675661,,happy,"Reddit Couple 337 Days Later, about a year ago my childhood bestfriend and I went to a BB&amp;T and got married because of Covid, now 337 Days Later, we're welcoming a third member to our family. ❤️ Had to Share with the reddit fam.",https://i.redd.it/zlbcuqgpcai61.jpg,1613646861.0
206,Savings_Access_8468,1613673616,[https://youtu.be/FnbzUb\_Sxww](https://youtu.be/FnbzUb_Sxww),happy,this vid is my first vid please check it out,https://www.reddit.com/r/happy/comments/lmtsqs/this_vid_is_my_first_vid_please_check_it_out/,1613644816.0
207,Arewasound1,1613673417,,happy,What about you??,https://i.redd.it/jzjrh6wz5ai61.png,1613644617.0
208,Arewasound1,1613673175,,happy,What about you....,https://i.redd.it/050xipy95ai61.png,1613644375.0
209,froswegia,1613671669,,happy,this made me smile,https://i.redd.it/swfuikws09i61.jpg,1613642869.0
210,Whoneedsspaces,1613671292,[removed],happy,I’ve met the love of my life and my life has changed. I think I’m finally happy and thinking positively about the future.,https://www.reddit.com/r/happy/comments/lmsugm/ive_met_the_love_of_my_life_and_my_life_has/,1613642492.0
211,Whoneedsspaces,1613671066,[removed],happy,My girlfriend brightened up my life.,https://www.reddit.com/r/happy/comments/lmsr69/my_girlfriend_brightened_up_my_life/,1613642266.0
212,TheTatteredOne,1613667906,"Now, im almost surely gonna fuck this up some kinda way.

I have basically zero experience with women over the last...eon so I'm still just kind of in the getting-back-into-the-swing-of-things stage. 

But, even if it was a complete accident she's *bad*. So idk, it was nice. Cool lil boost",happy,I got exactly the kinda girl i want to swipe right,https://www.reddit.com/r/happy/comments/lmrj1e/i_got_exactly_the_kinda_girl_i_want_to_swipe_right/,1613639106.0
213,DefiantCondor,1613667101,"I recently chatted to and met the most incredible woman. We are both apparently quite mad into each other, for weeks talk and chat for hours every day.. I havent felt like this about someome since i was 16 or so and i am smiling ear to ear every day. I am also starting my best ever paying job in a few weeks...i feel like after a seemingly.endless wait life is finally falling into place. I havent felt close to this happy in soooo long...i needed to share XD",happy,I am so happy...I think I am falling in love again after 20 years,https://www.reddit.com/r/happy/comments/lmr6rx/i_am_so_happyi_think_i_am_falling_in_love_again/,1613638301.0
214,RhysEdwards14,1613666817,,happy,A guy singing about the corronivirus vaccine hope it makes your lockdown better,https://v.redd.it/vwcj419vl9i61,1613638017.0
215,Patient_Jacket_9372,1613664085,,happy,"Happy to have come this far, to have once been entirely against things like this and to now embrace not only myself but all LGBT+ people and aim to bring them up the way others have helped me.",https://i.redd.it/vaaksvzcu8i61.jpg,1613635285.0
216,Thorbort6969,1613662436,,happy,Daily Thoughts 85. Give your self a you day. :) you got this.,https://i.redd.it/kt8ip7vd99i61.jpg,1613633636.0
217,aehfaz3,1613661773,,happy,If Van Gogh visited us in the future!!,https://v.redd.it/so1nxmk579i61,1613632973.0
218,fmsummerguy72,1613659891,,happy,"YOU MAKE ME HAPPY ... By Flynn Garman If You Ever Wanted to Show and Tell someone that They Make You Happy, Here You Go! YOU MAKE ME HAPPY... XOOOOOOOX (KID SAFE) Please Feel Free to Share, or Like, or Save!!! Have A Happy Day!!! (@fmsummerguy72)",https://v.redd.it/d4vf8x48y8i61,1613631091.0
219,poetmars777,1613656942,I’m surprised but happy that the kid got personality types that are a combination of ours. “IN _ _” like mine and “_ _ FJ” like the dad’s.,happy,Kid got a combination of parents’ personality,https://www.reddit.com/r/happy/comments/lmnfty/kid_got_a_combination_of_parents_personality/,1613628142.0
220,bubblyelephants,1613651868,,happy,My true loves kissed proposed!,https://www.reddit.com/gallery/lmlu7j,1613623068.0
221,JimSmithFF,1613651406,[removed],happy,"Thеrе is a Youtubеr called ""Lеon Farаday"" that lеarns еvеrywееk а nеw skill. Нis rеlativеs раssed аway whеn he was 14, he mаkes vidеos abоut оwn expеrienсe of mastеring nеw skills for people to kееp motivаtiоn tо leаrn аnd try new things, becаusе wе havе only onе life !",https://www.reddit.com/r/happy/comments/lmlphi/thеrе_is_a_youtubеr_called_lеon_farаday_that/,1613622606.0
222,NoWorriesJake,1613646359,,happy,"Watching these two made me smile, so I’m sharing the happiness with you",https://v.redd.it/a9vj217ci6i61,1613617559.0
223,NoWorriesJake,1613646154,,happy,Two Best Friends,https://v.redd.it/a9vj217ci6i61,1613617354.0
224,NoWorriesJake,1613646034,,happy,Sending y’all a smile with this,https://v.redd.it/a9vj217ci6i61,1613617234.0
225,SicSemper00,1613643693,,happy,Sleepy boy,https://i.redd.it/qkpd1exmp7i61.jpg,1613614893.0
226,pauniwb,1613643435,,happy,"Birthday last year vs this year. Over this past year, I’ve lost over 100lbs, accepted the real me, and found utter happiness along the way. 25 will always be remembered as the year a started loving myself 💕 (MTF)",https://i.redd.it/m3u2oeyqrrp11.jpg,1613614635.0
227,JakeBrownPhoto,1613630450,,happy,Happy to get outside and enjoy a little nature/exercise with my family,https://i.redd.it/5vafc0v9m6i61.jpg,1613601650.0
228,depressedpanda123,1613627494,,happy,Brooooooo my sister stole my phone and snapped the girl I rlly like. I acted mad but rlly couldn’t be happier☺️☺️☺️,https://www.reddit.com/r/happy/comments/lmf61z/brooooooo_my_sister_stole_my_phone_and_snapped/,1613598694.0
229,minimalismemma,1613623473,"While being home with my family, I have created a routine of getting to bed early, waking up early, etc. I have been keeping with my routine and having this simple thing makes me so so happy.",happy,Having a routine is making me happy during quarantine,https://www.reddit.com/r/happy/comments/lmdz7s/having_a_routine_is_making_me_happy_during/,1613594673.0
230,minimalismemma,1613623364,[removed],happy,Routine makes me happy,https://www.reddit.com/r/happy/comments/lmdy2f/routine_makes_me_happy/,1613594564.0
231,gnocchi888,1613621905,"i don’t have many highs in my life but as of right now i am just so in love with my friends. do you ever feel like that? like your body is physically high in that everything just feels okay. how am i so blessed to have such beautiful people in life. i wanna go away for college and meet new people but i seriously have not met such amazing people and know i will miss them even tho life will eventually push us apart. i love them to death (keep in mind i was very lonely and had nobody in middle school) so i guess this makes up for it. i never knew humans could care so much about me. yea idk i wish covid would just end already so i can spend my last year with friends. im just so incredibly blessed man. keep in mind im not talking as if i have 10 friends i dead ass just have 3-4 friends in my life, you really don’t need a lot of people in your life. it’s kinda crazy to me how human connections are so real. I have really bad anxiety but I’m just songlad i get to feel this emotion sometimes.",happy,life why does the caption have to be over 40 for me to post lmao,https://www.reddit.com/r/happy/comments/lmdi9q/life_why_does_the_caption_have_to_be_over_40_for/,1613593105.0
232,gnocchi888,1613621633,[removed],happy,life,https://www.reddit.com/r/happy/comments/lmdfdl/life/,1613592833.0
233,yunggchemist,1613621429,,happy,My papa used to make me and my siblings root beer floats all the time when we were younger. Always like to come back to this drink and remember how much fun we had with him when we were kids,https://i.redd.it/ih15r36gv5i61.jpg,1613592629.0
234,cloud-bound_,1613621050,,happy,"15,000 Views And 200 Subscribers! I AM EXTREMELY HAPPY",https://www.reddit.com/gallery/lmd8y9,1613592250.0
235,Inazumaryoku,1613619990,,happy,Loving the fact that Mt. Fuji is just right there outside my window. It really is snowing on Mt. Fuji!,https://i.redd.it/5r5upv65r5i61.jpg,1613591190.0
236,callmevapelord,1613617912,,happy,"After a miscarriage a little over a year ago and many attempts later, my wife and I are finally expecting our first little one!",https://i.redd.it/96n57ilzk5i61.jpg,1613589112.0
237,ShopYourSook,1613615608,,happy,"To help small businesses compete with Amazon, I built a free plugin that shows you local alternatives for products when you're shopping online. It's been tough doing it by myself, but I saw an uptick in downloads &amp; found out this awesome guy made the case for it on Tik Tok better than I can!",https://streamable.com/pv6zjm,1613586808.0
238,ShopYourSook,1613615310,,happy,"To help small businesses compete with Amazon, I built a browser plugin that shows you local alternatives for products when you're shopping online. It's been tough doing it by myself, but I saw an uptick in downloads &amp; found out this awesome guy made the case for it on Tik Tok better than I can!",https://streamable.com/pv6zjm,1613586510.0
239,CourtM092,1613614165,,happy,"I had a brain injury in 2014. I couldn’t walk, talk, or even eat normally. Fast forward to now I’m trying to give back to those who helped me. I want people to feel welcomed, at ease, and valued like I did every time I came into the clinic.",https://i.redd.it/jqtj9ipu95i61.jpg,1613585365.0
240,FattyBeardman,1613612365,,happy,This is the most specific and targeted b-day message from a friend...,https://v.redd.it/lfi8yzrc45i61,1613583565.0
241,LovelyAmeliaJane,1613610761,,happy,Wednesday is my favorite week day... halfway to Friday :),https://i.redd.it/0hunhlaqz4i61.jpg,1613581961.0
242,LovelyAmeliaJane,1613610688,,happy,Happy its halfway to the weekend :),https://i.redd.it/xy5felfiz4i61.jpg,1613581888.0
243,Nohumidity,1613593420,[removed],happy,Glad to have found support on Reddit - Thank you,https://www.reddit.com/r/happy/comments/lm3pw9/glad_to_have_found_support_on_reddit_thank_you/,1613564620.0
244,Johannaof,1613590802,,happy,What made yourself happy today? I‘m so proud of myself that I did my workout 3 days in a row. Have to keep going 💪🏻,https://i.redd.it/wcrrh4ddc3i61.jpg,1613562002.0
245,fmsummerguy72,1613590265,,happy,YOU MAKE ME HAPPY... By Flynn Garman If You Ever Wanted to Show and Tell Someone that They Make You Happy... Please Feel Free to Share this Little Guy with Friends and Family!!! YOU MAKE ME HAPPY !!!,https://youtu.be/2CKZtPPUnIM,1613561465.0
246,punkeddiemurphy,1613589985,,happy,"After being put at risk of redundancy, I have secured a new job working for a music charity. It's my dream job.",https://www.reddit.com/r/happy/comments/lm2g4t/after_being_put_at_risk_of_redundancy_i_have/,1613561185.0
247,DonDickerson,1613587194,[removed],happy,"The ""Rush"" makes me happy",https://www.reddit.com/r/happy/comments/lm1ee3/the_rush_makes_me_happy/,1613558394.0
248,fmsummerguy72,1613586641,,happy,"YOU MAKE ME HAPPY... By Flynn Garman If You Ever Wanted to Tell and Show Someone that You Love Them and That they make You HAPPY, Please feel Free to Share this Little Guy With Your Friends and Family!!! YOU MAKE ME HAPPY!!! XOOOOOOOX",https://v.redd.it/i3yzetkow2i61,1613557841.0
249,misstterr_a,1613585202,,happy,You Might Wanna Know This,https://youtu.be/pXreW34t-gw,1613556402.0
