,author,created_utc,selftext,subreddit,title,url,created
0,Gollum_Reads,1614184788,,happy,GOLLUM READS | The Day the Crayons Came Home,https://i.redd.it/61poytujegj61.jpg,1614155988.0
1,D_Trickster,1614184157,"Thought of this last night and just wanted to share with anyone who will listen. 

Happiness comes from within when you no longer look within yourself for happiness.  It is the feeling of self satisfaction you get from improving yourself or contributing to others.  Happiness is a verb.  It is not something you can look for because it is generated from within you.",happy,I finally have my own definition of happiness.,https://www.reddit.com/r/happy/comments/lrgugk/i_finally_have_my_own_definition_of_happiness/,1614155357.0
2,yeet9876543,1614181519,,happy,my art,https://www.reddit.com/gallery/lrfup5,1614152719.0
3,honest_scenario,1614181336,,happy,"I raised my niece after her parents separated and it was the best years of my life. And after finishing Stranger Things yesterday, this scene brought happy tears to my eyes because this is exactly how we looked at each other when I dropped her off at university last month to start her life",https://i.redd.it/0rt4emdc4gj61.jpg,1614152536.0
4,[deleted],1614179249,[deleted],happy,This dog went to Disney Land for the first time and is having the time of his life,https://i.redd.it/d82t0sy4yfj61.jpg,1614150449.0
5,[deleted],1614179123,[deleted],happy,Happy doggo,https://i.redd.it/5jgmd4grxfj61.jpg,1614150323.0
6,Infinitianss,1614176083,,happy,"Been Blogging for the past couple of months, and finally a proud moment for me to have crossed this important milestone. It truly means a lot.",https://i.redd.it/5bncn1sbofj61.jpg,1614147283.0
7,EnnaMoon87,1614173203,,happy,Can't wait for sundress season! My happiest time!,https://i.redd.it/qchs2aq5gfj61.jpg,1614144403.0
8,Sabatar446,1614172326,,happy,"Protestors in Yangon, Myanmar doing a native dance.",https://v.redd.it/b7w1tgg3dfj61,1614143526.0
9,Pax_Libertas_,1614172163," 

Hey guys, I am back with another spotlight! I was a bit late last month, but I've finally caught up! As usual, I have found a few hidden gems that I would love to share with you. The music is separated by platform. Each platform has artists that are unique to it, but it also has some of the same ones. I hope you guys enjoy the music, and thanks for giving these musicians a chance!

[Spotify](https://open.spotify.com/playlist/1JazK1vO4xdWCritXaDun8?si=XaFhCge0TLaGeAw7RodOPA)

[Soundcloud](https://soundcloud.com/kittensrjerks/sets/imf-favorites-jan-2021)

[YouTube](https://www.youtube.com/watch?v=nUuFEKdcEqg&amp;list=PLYbyG3wDWegU23B8qXzjZTKu8FGSp29_x&amp;ab_channel=CaptainVapid)",happy,"During the month of January, I listened to over 800 songs that were posted to Reddit by independent musicians. Whenever I ran into one that blew me away, I added it to this playlist! I'd love to share it here with anyone interested.",https://www.reddit.com/r/happy/comments/lrci8i/during_the_month_of_january_i_listened_to_over/,1614143363.0
10,[deleted],1614170189,[deleted],happy,I wrote and sent my niece that I helped raise a letter to her up at college. Thought I'd share it,https://www.reddit.com/r/happy/comments/lrbupf/i_wrote_and_sent_my_niece_that_i_helped_raise_a/,1614141389.0
11,ranamohammedd,1614167937,,happy,تفائل بالخير تجده,https://i.redd.it/qgmflgwd0fj61.png,1614139137.0
12,vizualdesperada,1614152138,,happy,"My 14 year old brother told me he loved me this morning and I'm so happy. He never says it unless he wants sth from me ( ͡°╭╮ ͡°), but this was so random and sweet at the start if my day.",https://i.redd.it/v0dsomnipdj61.jpg,1614123338.0
13,[deleted],1614152103,[deleted],happy,"My 14 year old brother told me he loved me this morning and I'm so happy. He never says it unless he wants sth from me ( ͡°╭╮ ͡°), but this was so random and sweet at the start if my day.",https://i.redd.it/w73pcpdepdj61.jpg,1614123303.0
14,feenfornicotine,1614147668,,happy,"Heyy I just made a discord server and I'm looking for new friends! 🐢 I'm okay with the server growing slowly as long as my members are active and chill ✌🌿🍄 if your nervous to join then just come in with song, anime, movie, or game recs for me to check out! Would love to see you join :)",https://discord.gg/ZRR3VyJVun,1614118868.0
15,BlitheNonchalance,1614146669,,happy,"This photo of myself in 1992 made me happy, so I figured why not share. Have a good day on purpose, people!",https://i.redd.it/aoz4wq299dj61.jpg,1614117869.0
16,comethobnob,1614146214,[removed],happy,Best friends/family,https://www.reddit.com/r/happy/comments/lr56yb/best_friendsfamily/,1614117414.0
17,minimalismemma,1614143545,"I recently had a horrible breakup with my ex. He did it over text. It was honestly so mean and hurtful- BUT- today I wrote a letter to him. Burnt it. Went to the beach and took a few deep breaths and I felt so much better. Cried it out a little.... I am ready to move on and forgive him.... I read a quote that said ""when you hold onto anger it is like holding onto a hot coal with the intention of throwing it- instead you are the one that gets burned""- I am no longer grasping onto that hot coal....",happy,I finally forgave my ex... moving on and embracing forgiveness and peace,https://www.reddit.com/r/happy/comments/lr4fzu/i_finally_forgave_my_ex_moving_on_and_embracing/,1614114745.0
18,SomolianButtPirate,1614141390,,happy,I am high and I love my new haircut. Life is good,https://i.redd.it/0tuyzn1ktcj61.jpg,1614112590.0
19,iwannaBtheverybest_,1614134025,,happy,"I know it's kind of lame, but I'm too old to have never learned the basic life skill of cooking. I made a burger for the first time in my entire life today. I had to cut it into 1/4ths to make sure it was done, and it was messy- BUT HEY I DID IT YOU GUYS!!! 😎",https://www.reddit.com/gallery/lr1bz9,1614105225.0
20,[deleted],1614133041,[deleted],happy,25 more days until spring!,https://i.redd.it/1hpuqqmp4cj61.jpg,1614104241.0
21,TACZero,1614132787,,happy,My university gave us the day off so my roommate and I made dumplings!,https://www.reddit.com/gallery/lr0po5,1614103987.0
22,moreespressonodepres,1614132437,[removed],happy,IM DONE,https://www.reddit.com/r/happy/comments/lr0ium/im_done/,1614103637.0
23,CodBlowsDogs4qtrs,1614130201,"I've been oblivious to my co-workers recently saying another name around me lately. I have a couple co-workers who would say ""Tim is here"" when I would walk in, and I just thought we hired a Tim recently and I wanted to meet the dude. Turns out they told me I was that Tim today and I didn't think anything of it. So I never knew what a Tim really was until I actually Googled it. Turns out the term is basically a Celtic support of other people. Made me feel good about myself. I appreciate my work friends and they always seem to put a smile on my face. Thanks guys/gals.",happy,"Within two months of working for this company, my co-workers now call me a Tim...",https://www.reddit.com/r/happy/comments/lqzjpf/within_two_months_of_working_for_this_company_my/,1614101401.0
24,Murky_Drop_6780,1614129724,,happy,Stuffies make me so happy ^^ they never ever leave me ever ever,https://www.reddit.com/gallery/lqze30,1614100924.0
25,Murky_Drop_6780,1614129674,,happy,Hehe,https://www.reddit.com/gallery/lqzdip,1614100874.0
26,[deleted],1614129227,,happy,Work associates now call me a Tim,https://www.reddit.com/r/happy/comments/lqz89a/work_associates_now_call_me_a_tim/,1614100427.0
27,EquanimityVibe,1614115848,[removed],happy,Got my first COVID vaccination yesterday,https://www.reddit.com/r/happy/comments/lqtm95/got_my_first_covid_vaccination_yesterday/,1614087048.0
28,EquanimityVibe,1614115719,[removed],happy,I got my first shot!,https://www.reddit.com/r/happy/comments/lqtkcp/i_got_my_first_shot/,1614086919.0
29,emid11,1614115659,,happy,"i decided to be bold and dye my hair from blonde to black and red! even though my family is a little upset, i am so happy with how it turned out :) i really feel like i have been able to express myself!",https://i.redd.it/4we53uu1paj61.jpg,1614086859.0
30,[deleted],1614110701,[deleted],happy,Love with the right person is so beautiful.,https://www.reddit.com/r/happy/comments/lqrmiz/love_with_the_right_person_is_so_beautiful/,1614081901.0
31,aulei,1614108155,,happy,"After feeling so hopeless for so long, I’m finally learning to find joy in the small moments ❤️",https://i.redd.it/tl71wy2q2aj61.jpg,1614079355.0
32,[deleted],1614107855,,happy,It feels good to be appreciated by someone I thought would hate me,https://www.reddit.com/r/happy/comments/lqqi7r/it_feels_good_to_be_appreciated_by_someone_i/,1614079055.0
33,[deleted],1614107427,,happy,Being appreciated feels good,https://www.reddit.com/r/happy/comments/lqqbwt/being_appreciated_feels_good/,1614078627.0
34,Just_Justin_Right,1614107109,,happy,My 3d printed object is geting there. Happy cause this is my first time 3d printing something woohoo. I'll update soon,https://www.reddit.com/gallery/lqq7bx,1614078309.0
35,YouTubeMeredith,1614106551,,happy,Ever feel like you're down but you just don't know how to fix it..here's how you can improve your mood in 60 seconds,https://www.youtube.com/watch?v=DPhBZdOpRyY,1614077751.0
36,ShopYourSook,1614106508,,happy,"Last year, I was walking &amp; wondering how to make it easier to connect my community with the small businesses I saw struggling. I decided to make a browser extension called Sook that makes it easy to buy from local businesses when you’re online. Got a great endorsement today!",https://i.redd.it/gs5eug7tx9j61.png,1614077708.0
37,anthonytrainer,1614105653,,happy,"You are the first priority. Without you, the others that need you won’t have you to fall back on. It’s important to give yourself the air mask first, then give 10 other people an air mask. The more you help yourself, the more people you can help in return.",https://i.redd.it/u4t6jprav9j61.jpg,1614076853.0
38,YouTubeMeredith,1614105258,,happy,Improve Your Mood In 60 seconds,https://youtu.be/DPhBZdOpRyY,1614076458.0
39,GimmieGnomes,1614103718,,happy,I made my first ever latte. A bad day has become better.,https://i.redd.it/ihqbjjbjp9j61.jpg,1614074918.0
40,Exronize,1614102807,,happy,😁😁,https://v.redd.it/vtddqucwl9j61,1614074007.0
41,YouTubeMeredith,1614099301,,happy,Make yourself feel warm and fuzzy,https://youtu.be/aLNuJ33u2hY,1614070501.0
42,MuhammadMussab,1614087348,,happy,[News] Kage no Jitsuryokusha ni Naritakute will be receiving an Anime adaptation,https://twitter.com/RanobeSugoi/status/1364111149290061824,1614058548.0
43,omni68,1614087112,,happy,"Anybody here who uses Alexa may enjoy this “Something Nice” skill, which shares positive/ego-boosting compliments.",https://alexa-skills.amazon.com/apis/custom/skills/amzn1.ask.skill.b1852ed1-59b7-4966-bd13-dedd15cecb5f/launch,1614058312.0
44,RandomPengune,1614087074,,happy,This guy saved the life of a parrot and took care of it!,https://v.redd.it/mvkr5ptja7j61,1614058274.0
45,[deleted],1614087014,[deleted],happy,This guy saved the life of a parrot who’s mother passed away and took care of it,https://v.redd.it/mvkr5ptja7j61,1614058214.0
46,[deleted],1614086948,[deleted],happy,This guy saved the life of a parrot who’s mother passed away and took care of it,https://v.redd.it/mvkr5ptja7j61,1614058148.0
47,[deleted],1614086889,[deleted],happy,This guy saved the life of a parrot!,https://v.redd.it/mvkr5ptja7j61,1614058089.0
48,[deleted],1614086771,[deleted],happy,This guy saved the life of a parrot who’s mother passed away and took care of it,https://v.redd.it/mvkr5ptja7j61,1614057971.0
49,Outrageous_Ad2378,1614072160,Nice site,happy,https://blog.coinclaim.io/say-hello-to-satorify-coinclaims-improved-earning-platform/,https://www.reddit.com/r/happy/comments/lqe9uo/httpsblogcoinclaimiosayhellotosatorifycoinclaimsim/,1614043360.0
50,Alyxis2004,1614057056,,happy,I hope everyone having a wonderful day/night!!:),https://v.redd.it/m2l5tpjpu5j61,1614028256.0
51,YaBoySamy,1614055899,"TLDR: Never had a serious relationship until I found the girl I’m one day going to marry. 

This will probably get buried, but at least It’s here. After years of never having a relationship that lasted longer then like a week I’ve found the one, I’m going to marry. 6 months ago I re-met a girl from my past. I remember really liking her whenever we hung out, but I never really got to know her that well and it had been years since we had seen or talked to each other.  (Because she lives 6 hours away) When we re-met we instantly hit it off and within a few days of catching up we decided we wanted to date. We took it slow for the first 5 months and stayed in the unofficial staged, until last month we officially started dating. I love her so much, I honestly don’t deserve her and I thank God for her. It feels so surreal knowing that I finally found the “One”. I apologize for the grammatically innocent sentences, I’m tired but wanted to post my thoughts.",happy,I found the Girl I’m going to one day marry!,https://www.reddit.com/r/happy/comments/lq9m43/i_found_the_girl_im_going_to_one_day_marry/,1614027099.0
52,ram22252,1614051113,,happy,Been drawing a lot since the start of covid and this is one of my favorite anime style drawings I made :),https://i.redd.it/33ee3dc4d5j61.jpg,1614022313.0
53,dallasinwonderland,1614040065,,happy,"It's my cake day, so here's my pretty plant corner. It makes me happy to have something to nurture during this terrible time. 💕",https://i.redd.it/iriysg99g4j61.jpg,1614011265.0
54,80sRetro1,1614039132,[removed],happy,"I won an award the other day, today I got my plaque. That was kinda cool.",https://www.reddit.com/r/happy/comments/lq451y/i_won_an_award_the_other_day_today_i_got_my/,1614010332.0
55,LoveWhoYouWant,1614039120,"[removed]

[View Poll](https://www.reddit.com/poll/lq44wt)",happy,What are you?,https://www.reddit.com/r/happy/comments/lq44wt/what_are_you/,1614010320.0
56,recjus85,1614036658,,happy,"Here is my grandfather. Turned 101 today! That's his favorite dessert, butterscotch pie.",https://i.redd.it/cbzw4d3564j61.jpg,1614007858.0
57,pastdancer,1614034558,,happy,"Just completed my 600th mile of running since lockdown started about a year ago. Not great for actual runners, but I haven’t killed a single person I love this past year, so I am STOKED.",https://i.redd.it/jwxw53vvz3j61.jpg,1614005758.0
58,Onibonnie22,1614029366,[removed],happy,Happy,https://www.reddit.com/r/happy/comments/lq0hvb/happy/,1614000566.0
59,Distinct_Mark,1614027983,,happy,"That feeling you get when you’re all set and ready to begin teaching a class that starts in September (of 2021), and it’s only February!!!PRICELESS!!! 🤗",https://i.redd.it/p9k696ybg3j61.jpg,1613999183.0
60,GremlinFiend2121,1614023994,,happy,I finally got to get my hair dyed for the first time ever!,https://i.redd.it/nvwysn9h43j61.jpg,1613995194.0
61,daisychain066,1614023883,"For weeks I’ve been struggling to make appointments with referral doctors to Address my eating disorder. I’m a functioning adult and stuff....and never had this problem. At times it just felt impossible and I hated myself for being hung up on it. 
Just now I had a follow up visit over the phone with my primary care practitioner and confessed how hard it was to follow the plan and make appointments due to being afraid of recovery.
After a short pause, He then promised me that he would make the calls and schedule the appointment for me as long as I promised I’d show up. 😭 
Just, wow...THANK YOU.",happy,Unbelievable patience and kindness above the call of duty by my doctor,https://www.reddit.com/r/happy/comments/lpy5x3/unbelievable_patience_and_kindness_above_the_call/,1613995083.0
62,OkPin42,1614023726,,happy,This makes me sad that I gave my wholesome award to something less deserving than this.,https://v.redd.it/4fas7ks3qvi61,1613994926.0
63,[deleted],1614023697,[deleted],happy,Dad Level OVER 9000,https://v.redd.it/4fas7ks3qvi61,1613994897.0
64,OkPin42,1614023618,,happy,Dad Level OVER 9000,https://v.redd.it/4fas7ks3qvi61,1613994818.0
65,jessica_ann1,1614020272,,happy,took come cute photos the other day! youtube- jessica ann,https://www.reddit.com/gallery/lpwm5s,1613991472.0
66,jessica_ann1,1614020142,,happy,How to get the confidence to start a YouTube channel!,https://youtu.be/brvXeawreWg,1613991342.0
67,_kana_i,1614014323,"
So my friend just started a Twitch channel and is INCREDIBLY hyped up about it and is so invested. He even commissioned me do some art for his channel and was so excited about it. He reached 10 followers yesterday and is LOSING IT haha.

It’s his birthday this week and I wanted to see if I could surprise him with some followers and really freak him out, so if you guys could help out that would be great :) 

He does a lot of Battlefront II, COD, FIFA, Rocket League, and a bunch of other things like that and his channel is: 

wynnvillain

Have a great day guys!!!",happy,HELP ME REDDIT! My current happiness project right now is surprising my friend for his birthday with Twitch followers (he is wholesomely invested in it),https://www.reddit.com/r/happy/comments/lpu124/help_me_reddit_my_current_happiness_project_right/,1613985523.0
68,_kana_i,1614013576,[removed],happy,WHOLESOME GAMING MOMENT (HELP!),https://www.reddit.com/r/happy/comments/lptp0u/wholesome_gaming_moment_help/,1613984776.0
69,Gollum_Reads,1614013514,,happy,"GOLLUM READS, Children's Books | Jack in the Beanstalk",https://i.redd.it/34g3u79s72j61.jpg,1613984714.0
70,NoWorriesJake,1614012982,,happy,105-Year-Old Cyclist Rides 14 Miles In An Hour En Route To A World Record,https://www.npr.org/sections/thetwo-way/2017/01/04/508213332/105-year-old-cyclist-rides-14-miles-in-an-hour-en-route-to-a-world-record?utm_campaign=storyshare&amp;utm_source=facebook.com&amp;utm_medium=social&amp;fbclid=IwAR1EestAZEPb2xYCwubBDNKgdaodVAvKXo5ihBh_GYnDbBfRGiyjSMW5IBU,1613984182.0
71,Iamausernamedbob,1614009292,,happy,I made this to tell myself to be happy!,https://i.redd.it/6m9nc9jiw1j61.png,1613980492.0
72,fmsummerguy72,1614008371,,happy,YOU MAKE ME HAPPY... If You Ever wanted to Show and Tell Someone that They Make You HAPPY... This is the Video for YOU!!!! Have a Great Day! Video by Flynn G. @fmsummerguy72,https://i.redd.it/h932fg07r1j61.jpg,1613979571.0
73,callumstictachead,1614006283,took me a long time to find my happiness but if i have so will you:),happy,today is just one of those days where im in love with being alive,https://www.reddit.com/r/happy/comments/lpq5jx/today_is_just_one_of_those_days_where_im_in_love/,1613977483.0
74,callumstictachead,1614006266,took me a long time to find my happiness but if i have so will you:),happy,today is just one of those days where im in love with being alive,https://www.reddit.com/r/happy/comments/lpq5ac/today_is_just_one_of_those_days_where_im_in_love/,1613977466.0
75,Infinitianss,1614004671,[https://www.youtube.com/watch?v=Hb2JpjM7fhI](https://www.youtube.com/watch?v=Hb2JpjM7fhI),happy,"Listen to the audio version of my article, ""How to Calm your Mind Once and for all?"" and swoon over my melodious voice :) I promise you won't be disappointed.",https://www.reddit.com/r/happy/comments/lpphqb/listen_to_the_audio_version_of_my_article_how_to/,1613975871.0
76,faimippermFedjb,1613991442,,happy,I've been worrying for months about telling my new boss I need time off for surgery (I'm trans). Finally sent the email this morning and his response made me cry!,http://imgur.com/8J1NZq4.jpg,1613962642.0
77,Johannaof,1613990568,,happy,The sun is sooo beautiful since a few days! I really enjoy to be outside with a friend and having a good talk! Definitely ready for summer! ☀️,https://i.redd.it/8ctx3yy2d0j61.jpg,1613961768.0
78,breemwb,1613988535,,happy,"In the space of 3 months I recommenced working after 2 years rehabilitation from an accident, got engaged to the love of my life and last week we welcomed the most gorgeous, placid little pup into our lives 😍 didn’t know it was possible to feel this much joy ♥️",https://www.reddit.com/gallery/lpkilg,1613959735.0
79,justaguywithatripod,1613987280,,happy,One hour of taking a break from the real world to watch the waves roll in,https://youtu.be/9AF4muDqc-k,1613958480.0
80,CoolFortniteKiller,1613986935,,happy,So happy with our son 😊❤️. Me and my bf have been together for 2 years and finally made the big step.,https://i.redd.it/ek2xktea20j61.jpg,1613958135.0
81,_Love_Is_The_Answer_,1613984335,,happy,So happy with our son 😊❤️,https://i.redd.it/ob6hpb1kuzi61.jpg,1613955535.0
82,Tlr321,1613970119,"

I’ve been job hunting for the better part of a year now. For the last 5 years, I’ve been the manager at a McDonalds while I went to college. What was supposed to be a 6-month job to help me afford my dream camera, turned into 5 years of stress, anxiety, long days, early mornings, late nights, and irregular schedules. I’ve worked about 50 hours a week for almost two years now- only getting two days off in a row if I specifically requested it. I didn’t get medical, PTO, or any other benefits besides 30% off meals.

Starting tomorrow, I get 3 weeks PTO, Sat/Sun off, I start at 9am and I’m off at 5pm, I get medical, and the best part, my pay has increased. By a lot. I’m having a hard time coping with it, because it just feels too good to be real. When I got the job, I nearly fainted because I thought I did horribly in the interview. For once I’m so excited about my future. I finally have hope again.",happy,"After Five years working in a fast food kitchen, I finally start a comfortable office job in the morning.",https://www.reddit.com/r/happy/comments/lpfmfn/after_five_years_working_in_a_fast_food_kitchen_i/,1613941319.0
83,minimalismemma,1613969914,I had to move back home because of the pandemic and it has it's ups and downs. But today was my sisters birthday and that made me realize- wow- if I wasn't staying at home- I would miss this. Because my college is too far for me to travel. It just made me so much happier to know that I would be here with my family.... for moments like these.,happy,I am now more grateful to be living at home,https://www.reddit.com/r/happy/comments/lpfk6c/i_am_now_more_grateful_to_be_living_at_home/,1613941114.0
84,minimalismemma,1613969861,[removed],happy,Being grateful for living at home again,https://www.reddit.com/r/happy/comments/lpfjng/being_grateful_for_living_at_home_again/,1613941061.0
85,TrendingBot,1613968778,,happy,/r/happy enters TOP 5000 subreddits,https://frontpagemetrics.com/r/happy,1613939978.0
86,Tlr321,1613968568,[removed],happy,I start a new job in the morning.,https://www.reddit.com/r/happy/comments/lpf6hp/i_start_a_new_job_in_the_morning/,1613939768.0
87,NolyPolyBeanBurrito,1613965820,[removed],happy,I’m tired of trying to be positive,https://www.reddit.com/r/happy/comments/lpeddn/im_tired_of_trying_to_be_positive/,1613937020.0
88,[deleted],1613964248,[deleted],happy,"'How it Started vs How it's Going' We met in preschool, and married in October after twenty six years of friendship.",https://i.redd.it/79zvnxjn5yi61.jpg,1613935448.0
89,steviemorosey,1613958498,"I’m 18 right now, I feel a bit behind but I probably shouldn’t. I want to be a professional musician, and really do believe I can make it, but if I can’t then I’ll go to college and become a high school art teacher. And I really think I’d love that too, because I could help kids and listen to the music I like all day. And my mom is perfectly happy to have me stay home right now and just practice my art :-)) I’m so grateful for her and my dad. 
I’m just very appreciative of all the opportunity I have and how I’ll be happy regardless of what happens. I’ve dealt very seriously with depression my whole life, I mean genuinely suicidal in elementary school level, but idk I have some sense of hope right now :~)))",happy,I’m so secure in what I’m doing with my life,https://www.reddit.com/r/happy/comments/lpc6l8/im_so_secure_in_what_im_doing_with_my_life/,1613929698.0
90,OhnonotNiki,1613956221,,happy,Happy I made it to 35 years and six days so far.,https://i.redd.it/dvqq8whyixi61.jpg,1613927421.0
91,SunflowerPrincess_22,1613953539,,happy,"Finally have a reliable car of my own, no more asking to borrow other's.",https://i.redd.it/0xg8n3uxaxi61.jpg,1613924739.0
92,barcased,1613950648,"Because 12 years ago on this very day, I was told I don't have too long on this planet.

Luckily, they were mistaken.

Be happy. Be well.",happy,"Today, I am happy to celebrate my cake day. Why is that important?",https://www.reddit.com/r/happy/comments/lp9pss/today_i_am_happy_to_celebrate_my_cake_day_why_is/,1613921848.0
93,barcased,1613950276,[removed],happy,"12 years ago, I was diagnosed with a tumor on both lungs",https://www.reddit.com/r/happy/comments/lp9lew/12_years_ago_i_was_diagnosed_with_a_tumor_on_both/,1613921476.0
94,barcased,1613950229,[removed],happy,12 years ago,https://www.reddit.com/r/happy/comments/lp9kvw/12_years_ago/,1613921429.0
95,calvi219,1613948963,,happy,An Early Undergrad Graduation Gift From My Mom :),https://i.redd.it/1qprn71dxwi61.jpg,1613920163.0
96,happybuddharitual,1613945407,[removed],happy,A very smitten kitten,https://www.reddit.com/r/happy/comments/lp7ywe/a_very_smitten_kitten/,1613916607.0
